{
  "schemaVersion": "shared-session-1",
  "key": "aaaaaaaaaaaaaaaaaaaaaaaaaaaaaaaaaaaaaaaaaaaaaaaaaaaaaaaaaaaaaaaa",
  "account": "tester",
  "engine": { "name": "playwright", "version": "1.61.1", "spiVersion": 1 },
  "platform": "web",
  "appIdentity": "bbbbbbbbbbbbbbbbbbbbbbbbbbbbbbbbbbbbbbbbbbbbbbbbbbbbbbbbbbbbbbbb",
  "createdAt": "2026-10-29T00:00:00.000Z",
  "state": {
    "format": "playwright-storage-state",
    "version": 1,
    "algorithm": "A256GCM",
    "iv": "AAAAAAAAAAAAAAAA",
    "tag": "AAAAAAAAAAAAAAAAAAAAAA==",
    "ciphertext": "AAAA"
  }
}
